Price,Bedrooms,Bathrooms,Square Footage,Lot Size (Acres),Features,Listing Description
308600.0,3,1.5,1292,0.15,"['functional storage', 'basic landscaping', 'updated kitchen', 'ceiling fans', 'nice appliances', 'modern lighting']","Your search for perfection ends here! This pristine 3-bedroom home is simply incomparable. Located in a quiet cul-de-sac, the 1292 square foot residence is a breath of fresh air. 1.5 elegantly appointed bathrooms complement the 0.1-acre grounds. Experience living at its finest with extraordinary features including modern lighting, updated kitchen, basic landscaping, functional storage, nice appliances. An investment in your future at $308,600.0."
400500.0,4,2.5,2156,0.33,"['hardwood floors', 'smart home features', 'energy-efficient systems', 'walk-in closets', 'professional landscaping', 'outdoor living spaces', 'designer windows', 'high-end appliances', 'gourmet kitchen', 'spa-like bathrooms']","Prepare to be amazed by this stunning 4-bedroom masterpiece. Anchored in a prime location, the 2156 square foot home is a testament to sophisticated living. 2.5 luxurious bathrooms complement the expansive 0.3-acre property. Experience the extraordinary with features like walk-in closets, designer windows, professional landscaping, spa-like bathrooms, high-end appliances. Sensationally priced at $400,500.0."
152100.0,2,1.5,922,0.11,"['vinyl siding', 'standard windows', 'modest kitchen', 'simple appliances', 'basic tile floors']","Welcome home to elegance! This stunning 2-bedroom sanctuary redefines residential living. Proudly positioned in a tree-lined street, the 922 square foot home is a masterclass in design. 1.5 spa-like bathrooms complement the expansive 0.1-acre grounds. Be impressed by premium features including modest kitchen, simple appliances, standard windows. An unparalleled opportunity at $152,100.0."
368600.0,4,2.5,1774,0.47,"['outdoor living spaces', 'custom lighting', 'designer windows', 'spa-like bathrooms', 'high-end appliances', 'smart home features', 'walk-in closets', 'gourmet kitchen', 'hardwood floors']","Welcome to your dream home! This breathtaking 4-bedroom residence redefines modern living. With 2.5 meticulously designed bathrooms and 1774 square feet of living space, every inch has been carefully considered. The 0.5-acre lot provides ample room for your lifestyle. Highlights include custom lighting, hardwood floors, walk-in closets. At $368,600.0, this home is a rare find you won't want to miss."
227500.0,2,1.0,1154,0.12,"['nice appliances', 'hardwood floors', 'modern lighting', 'energy-efficient windows', 'functional storage', 'ceiling fans', 'basic landscaping', 'updated kitchen']","Discover a charming 2-bedroom home that truly stands out in this quiet cul-de-sac. Spanning 1154 square feet on a 0.1-acre lot, this property offers 1 bathrooms and unparalleled charm. Standout features include nice appliances, ceiling fans, updated kitchen, energy-efficient windows. Priced at $227,500.0, this home represents an extraordinary opportunity for discerning buyers."
372600.0,3,2.0,1312,0.14,"['smart home features', 'spa-like bathrooms', 'professional landscaping', 'outdoor living spaces', 'high-end appliances', 'custom lighting', 'energy-efficient systems', 'hardwood floors', 'gourmet kitchen', 'designer windows', 'walk-in closets']","Introducing a home that checks every box! This sophisticated 3-bedroom property is a true showstopper. Perfectly situated in a scenic enclave, the 1312 square foot home is a work of art. 2 stunning bathrooms grace this 0.1-acre estate. Fall in love with unique features like custom lighting, spa-like bathrooms, hardwood floors, outdoor living spaces. Remarkably accessible at $372,600.0."
218500.0,3,2.0,1125,0.15,"['hardwood floors', 'modern lighting', 'nice appliances', 'updated kitchen', 'basic landscaping', 'energy-efficient windows', 'functional storage', 'ceiling fans']","Prepare to be amazed by this remarkable 3-bedroom masterpiece. Anchored in a tree-lined street, the 1125 square foot home is a testament to sophisticated living. 2 luxurious bathrooms complement the expansive 0.1-acre property. Experience the extraordinary with features like modern lighting, functional storage, energy-efficient windows, nice appliances. Sensationally priced at $218,500.0."
150000.0,2,1.0,908,0.12,"['modest kitchen', 'vinyl siding', 'basic tile floors', 'basic lighting', 'standard windows', 'simple appliances']","Introducing a home that checks every box! This delightful 2-bedroom property is a true showstopper. Perfectly situated in a quiet cul-de-sac, the 908 square foot home is a work of art. 1 stunning bathrooms grace this 0.1-acre estate. Fall in love with unique features like basic tile floors, vinyl siding, simple appliances, modest kitchen, standard windows. Remarkably accessible at $150,000."
154700.0,2,1.0,988,0.12,"['standard windows', 'simple appliances', 'basic tile floors', 'vinyl siding', 'basic lighting', 'modest kitchen']","A home that truly has it all! This serene 2-bedroom property is a game-changer. Situated in a desirable subdivision, the 988 square foot layout maximizes every square inch. 1 beautifully designed bathrooms grace this 0.1-acre retreat. Fall in love with exceptional features such as modest kitchen, basic tile floors, vinyl siding. An incredible value at $154,700.0."
302300.0,5,3.0,2062,0.23,"['modern lighting', 'nice appliances', 'hardwood floors', 'energy-efficient windows', 'basic landscaping', 'functional storage', 'updated kitchen', 'ceiling fans']","A rare find has arrived! This elegant 5-bedroom residence redefines home living. Commanding a prime location in a waterfront community, the 2062 square foot layout is pure inspiration. 3 carefully designed bathrooms and a 0.2-acre lot offer the ultimate in comfort and style. Be transformed by exceptional features such as modern lighting, basic landscaping, hardwood floors, functional storage. An unbelievable value at $302,300.0."
329000.0,3,1.5,1453,0.38,"['modern lighting', 'nice appliances', 'functional storage', 'ceiling fans', 'energy-efficient windows', 'hardwood floors', 'basic landscaping']","Your search for perfection ends here! This beautiful 3-bedroom home is simply incomparable. Located in a prime location, the 1453 square foot residence is a breath of fresh air. 1.5 elegantly appointed bathrooms complement the 0.4-acre grounds. Experience living at its finest with extraordinary features including energy-efficient windows, ceiling fans, nice appliances, hardwood floors, basic landscaping. An investment in your future at $329,000.0."
206500.0,2,1.5,976,0.05,"['functional storage', 'updated kitchen', 'modern lighting', 'basic landscaping', 'energy-efficient windows', 'hardwood floors', 'nice appliances', 'ceiling fans']","Perfection personified describes this serene 2-bedroom sanctuary. Located in a quiet cul-de-sac, this 976 square foot residence delivers on every level. With 1.5 well-designed bathrooms and a generous 0.1-acre lot, comfort meets sophistication. Indulge in exceptional amenities including nice appliances, functional storage, modern lighting, energy-efficient windows, updated kitchen. Your dream home awaits at just $206,500.0."
382900.0,4,2.5,1642,0.22,"['spa-like bathrooms', 'gourmet kitchen', 'energy-efficient systems', 'high-end appliances', 'custom lighting', 'outdoor living spaces', 'walk-in closets', 'professional landscaping', 'designer windows']","Your dream lifestyle starts here! This delightful 4-bedroom home is nothing short of spectacular. Perfectly positioned in a waterfront community, the 1642 square foot residence is a true standout. 2.5 designer bathrooms and a 0.2-acre lot create an unparalleled living experience. Be captivated by remarkable features including gourmet kitchen, designer windows, outdoor living spaces, energy-efficient systems, high-end appliances. An exceptional opportunity at $382,900.0."
152600.0,2,1.5,623,0.05,"['basic tile floors', 'modest kitchen', 'basic lighting', 'simple appliances']","Welcome home to elegance! This sophisticated 2-bedroom sanctuary redefines residential living. Proudly positioned in a tree-lined street, the 623 square foot home is a masterclass in design. 1.5 spa-like bathrooms complement the expansive 0.1-acre grounds. Be impressed by premium features including basic lighting, simple appliances, basic tile floors. An unparalleled opportunity at $152,600.0."
288800.0,2,1.0,1264,0.23,"['hardwood floors', 'functional storage', 'basic landscaping', 'updated kitchen', 'energy-efficient windows', 'ceiling fans', 'modern lighting']","Discover a impressive 2-bedroom home that truly stands out in this golf course adjacent. Spanning 1264 square feet on a 0.2-acre lot, this property offers 1 bathrooms and unparalleled charm. Standout features include updated kitchen, basic landscaping, modern lighting. Priced at $288,800.0, this home represents an extraordinary opportunity for discerning buyers."
182700.0,2,1.0,785,0.05,"['basic lighting', 'modest kitchen', 'basic tile floors']","Your search for perfection ends here! This modern 2-bedroom home is simply incomparable. Located in a quiet cul-de-sac, the 785 square foot residence is a breath of fresh air. 1 elegantly appointed bathrooms complement the 0.1-acre grounds. Experience living at its finest with extraordinary features including basic tile floors, modest kitchen, basic lighting. An investment in your future at $182,700.0."
228500.0,2,1.0,1106,0.08,"['ceiling fans', 'functional storage', 'nice appliances', 'basic landscaping', 'updated kitchen']","Prepare for love at first sight with this beautiful 2-bedroom retreat. Tucked away in a prime location, the 1106 square foot home is a sanctuary of modern design. 1 thoughtfully designed bathrooms complement the expansive 0.1-acre property. Discover exceptional living through features like nice appliances, ceiling fans, functional storage. An unbeatable value at $228,500.0."
302200.0,3,2.0,1121,0.14,"['modern lighting', 'ceiling fans', 'hardwood floors', 'updated kitchen', 'energy-efficient windows']","Discover your personal oasis in this serene 3-bedroom haven. Strategically located in a historic district, the 1121 square foot home is a breath of fresh air. 2 meticulously crafted bathrooms and a 0.1-acre lot offer the ultimate in privacy and comfort. Distinctive touches like energy-efficient windows, hardwood floors, ceiling fans, modern lighting set this property apart. Remarkably priced at $302,200.0."
210200.0,3,1.5,1302,0.15,"['hardwood floors', 'ceiling fans', 'basic landscaping', 'functional storage', 'nice appliances', 'energy-efficient windows', 'modern lighting', 'updated kitchen']","Introducing a home that checks every box! This beautiful 3-bedroom property is a true showstopper. Perfectly situated in a tree-lined street, the 1302 square foot home is a work of art. 1.5 stunning bathrooms grace this 0.1-acre estate. Fall in love with unique features like updated kitchen, nice appliances, ceiling fans, basic landscaping. Remarkably accessible at $210,200.0."
254300.0,3,2.0,1093,0.26,"['basic landscaping', 'hardwood floors', 'energy-efficient windows', 'updated kitchen', 'modern lighting', 'nice appliances', 'functional storage']","Prepare to be impressed by this delightful home that seamlessly blends comfort and style. Boasting 3 bedrooms, 2 bathrooms, and 1093 square feet of thoughtfully designed space, this riverside setting property sits on a 0.3-acre lot that promises privacy and potential. Unique features such as modern lighting, hardwood floors, basic landscaping, updated kitchen set this home apart. Offered at $254,300.0, this is an investment in your future."
443500.0,3,1.5,1249,0.25,"['smart home features', 'gourmet kitchen', 'walk-in closets', 'high-end appliances', 'spa-like bathrooms', 'hardwood floors', 'designer windows', 'energy-efficient systems', 'custom lighting', 'professional landscaping', 'outdoor living spaces']","Architectural brilliance meets everyday comfort in this luxurious 3-bedroom masterpiece. Commanding a prime spot in a urban oasis, the 1249 square foot residence speaks volumes. 1.5 designer bathrooms and a 0.2-acre lot create the ultimate living environment. Be captivated by unique elements such as gourmet kitchen, designer windows, spa-like bathrooms, high-end appliances. Exclusively available at $443,500.0."
235400.0,2,1.0,800,0.1,"['updated kitchen', 'modern lighting', 'energy-efficient windows', 'ceiling fans', 'functional storage', 'basic landscaping']","Architectural brilliance meets everyday comfort in this stunning 2-bedroom masterpiece. Commanding a prime spot in a peaceful neighborhood, the 800 square foot residence speaks volumes. 1 designer bathrooms and a 0.1-acre lot create the ultimate living environment. Be captivated by unique elements such as basic landscaping, modern lighting, ceiling fans. Exclusively available at $235,400.0."
414300.0,3,2.0,1591,0.36,"['walk-in closets', 'professional landscaping', 'spa-like bathrooms', 'hardwood floors', 'smart home features', 'custom lighting', 'outdoor living spaces', 'designer windows', 'high-end appliances', 'gourmet kitchen', 'energy-efficient systems']","Prepare to be impressed by this exceptional home that seamlessly blends comfort and style. Boasting 3 bedrooms, 2 bathrooms, and 1591 square feet of thoughtfully designed space, this sought-after community property sits on a 0.4-acre lot that promises privacy and potential. Unique features such as designer windows, gourmet kitchen, outdoor living spaces, custom lighting, hardwood floors set this home apart. Offered at $414,300.0, this is an investment in your future."
188700.0,2,1.0,977,0.05,"['basic tile floors', 'simple appliances', 'basic lighting', 'modest kitchen']","Experience luxury reimagined in this elegant 2-bedroom marvel. Situated in a riverside setting, the 977 square foot floor plan maximizes both style and function. Featuring 1 bathrooms and a sprawling 0.1-acre setting, every detail has been meticulously crafted. Standout characteristics include basic tile floors, modest kitchen, basic lighting, simple appliances. Your lifestyle upgrade awaits at $188,700.0."
366600.0,5,3.0,2098,0.15,"['outdoor living spaces', 'custom lighting', 'high-end appliances', 'gourmet kitchen', 'hardwood floors', 'smart home features', 'walk-in closets', 'designer windows', 'spa-like bathrooms']","Welcome to your dream home! This exceptional 5-bedroom residence redefines modern living. With 3 meticulously designed bathrooms and 2098 square feet of living space, every inch has been carefully considered. The 0.1-acre lot provides ample room for your lifestyle. Highlights include spa-like bathrooms, walk-in closets, designer windows, outdoor living spaces. At $366,600.0, this home is a rare find you won't want to miss."
527900.0,4,2.0,1817,0.44,"['outdoor living spaces', 'smart home features', 'spa-like bathrooms', 'hardwood floors', 'custom lighting', 'professional landscaping', 'energy-efficient systems', 'gourmet kitchen', 'designer windows']","Welcome home to elegance! This classic 4-bedroom sanctuary redefines residential living. Proudly positioned in a waterfront community, the 1817 square foot home is a masterclass in design. 2 spa-like bathrooms complement the expansive 0.4-acre grounds. Be impressed by premium features including designer windows, outdoor living spaces, professional landscaping, gourmet kitchen, hardwood floors. An unparalleled opportunity at $527,900.0."
150000.0,2,1.0,739,0.22,"['vinyl siding', 'basic tile floors', 'modest kitchen', 'simple appliances', 'standard windows']","Your search ends here! This modern 2-bedroom masterpiece is a testament to refined living. Nestled in a prime location, the 739 square foot home boasts 1 perfectly appointed bathrooms. The 0.2-acre property offers both elegance and functionality. Elevate your lifestyle with features like modest kitchen, basic tile floors, simple appliances, standard windows, vinyl siding. Competitively priced at $150,000, this home won't last long."
215600.0,2,1.0,1293,0.12,"['updated kitchen', 'ceiling fans', 'modern lighting', 'functional storage', 'nice appliances', 'basic landscaping', 'energy-efficient windows']","Your search for perfection ends here! This elegant 2-bedroom home is simply incomparable. Located in a scenic enclave, the 1293 square foot residence is a breath of fresh air. 1 elegantly appointed bathrooms complement the 0.1-acre grounds. Experience living at its finest with extraordinary features including functional storage, modern lighting, nice appliances. An investment in your future at $215,600.0."
373600.0,3,1.5,1300,0.1,"['walk-in closets', 'professional landscaping', 'spa-like bathrooms', 'gourmet kitchen', 'hardwood floors', 'designer windows', 'high-end appliances']","A true gem has arrived! This beautiful 3-bedroom home represents the pinnacle of contemporary living. Strategically positioned in a suburban retreat, the property spans 1300 square feet of pure inspiration. 1.5 bathrooms provide both luxury and practicality on a 0.1-acre canvas. Distinguished by professional landscaping, designer windows, walk-in closets, high-end appliances, gourmet kitchen, this home transcends ordinary expectations. Incredibly priced at $373,600.0, opportunity knocks."
273400.0,3,2.0,1260,0.11,"['energy-efficient windows', 'hardwood floors', 'modern lighting', 'updated kitchen', 'basic landscaping', 'functional storage', 'ceiling fans']","Your search ends here! This pristine 3-bedroom masterpiece is a testament to refined living. Nestled in a urban oasis, the 1260 square foot home boasts 2 perfectly appointed bathrooms. The 0.1-acre property offers both elegance and functionality. Elevate your lifestyle with features like energy-efficient windows, basic landscaping, functional storage. Competitively priced at $273,400.0, this home won't last long."
344000.0,3,1.5,1829,0.27,"['nice appliances', 'hardwood floors', 'ceiling fans', 'functional storage', 'modern lighting', 'energy-efficient windows', 'updated kitchen', 'basic landscaping']","A rare find has arrived! This magnificent 3-bedroom residence redefines home living. Commanding a prime location in a historic district, the 1829 square foot layout is pure inspiration. 1.5 carefully designed bathrooms and a 0.3-acre lot offer the ultimate in comfort and style. Be transformed by exceptional features such as ceiling fans, nice appliances, updated kitchen, hardwood floors, modern lighting. An unbelievable value at $344,000.0."
232900.0,3,1.5,1445,0.2,"['hardwood floors', 'energy-efficient windows', 'basic landscaping', 'ceiling fans', 'modern lighting', 'updated kitchen']","A rare find has arrived! This sophisticated 3-bedroom residence redefines home living. Commanding a prime location in a waterfront community, the 1445 square foot layout is pure inspiration. 1.5 carefully designed bathrooms and a 0.2-acre lot offer the ultimate in comfort and style. Be transformed by exceptional features such as basic landscaping, modern lighting, ceiling fans. An unbelievable value at $232,900.0."
307000.0,4,2.5,1569,0.1,"['functional storage', 'updated kitchen', 'nice appliances', 'energy-efficient windows', 'modern lighting']","Welcome home to elegance! This pristine 4-bedroom sanctuary redefines residential living. Proudly positioned in a urban oasis, the 1569 square foot home is a masterclass in design. 2.5 spa-like bathrooms complement the expansive 0.1-acre grounds. Be impressed by premium features including functional storage, modern lighting, energy-efficient windows, nice appliances, updated kitchen. An unparalleled opportunity at $307,000.0."
278700.0,2,1.5,1159,0.1,"['energy-efficient windows', 'basic landscaping', 'functional storage', 'modern lighting', 'ceiling fans', 'updated kitchen']","Welcome home to elegance! This charming 2-bedroom sanctuary redefines residential living. Proudly positioned in a suburban retreat, the 1159 square foot home is a masterclass in design. 1.5 spa-like bathrooms complement the expansive 0.1-acre grounds. Be impressed by premium features including modern lighting, basic landscaping, ceiling fans, functional storage, updated kitchen. An unparalleled opportunity at $278,700.0."
473100.0,4,2.5,1648,0.87,"['walk-in closets', 'spa-like bathrooms', 'energy-efficient systems', 'gourmet kitchen', 'smart home features', 'outdoor living spaces', 'designer windows']","Welcome home to elegance! This beautiful 4-bedroom sanctuary redefines residential living. Proudly positioned in a waterfront community, the 1648 square foot home is a masterclass in design. 2.5 spa-like bathrooms complement the expansive 0.9-acre grounds. Be impressed by premium features including outdoor living spaces, walk-in closets, gourmet kitchen, designer windows. An unparalleled opportunity at $473,100.0."
328300.0,3,2.0,1351,0.21,"['functional storage', 'nice appliances', 'modern lighting', 'ceiling fans', 'hardwood floors', 'basic landscaping']","A true gem has arrived! This remarkable 3-bedroom home represents the pinnacle of contemporary living. Strategically positioned in a scenic enclave, the property spans 1351 square feet of pure inspiration. 2 bathrooms provide both luxury and practicality on a 0.2-acre canvas. Distinguished by nice appliances, functional storage, ceiling fans, this home transcends ordinary expectations. Incredibly priced at $328,300.0, opportunity knocks."
339400.0,4,2.5,1532,0.1,"['modern lighting', 'basic landscaping', 'ceiling fans', 'functional storage', 'updated kitchen', 'energy-efficient windows', 'nice appliances']","Welcome to your dream home! This stunning 4-bedroom residence redefines modern living. With 2.5 meticulously designed bathrooms and 1532 square feet of living space, every inch has been carefully considered. The 0.1-acre lot provides ample room for your lifestyle. Highlights include energy-efficient windows, functional storage, ceiling fans, modern lighting, basic landscaping. At $339,400.0, this home is a rare find you won't want to miss."
251500.0,3,2.0,1273,0.22,"['energy-efficient windows', 'hardwood floors', 'modern lighting', 'basic landscaping', 'ceiling fans', 'nice appliances', 'functional storage', 'updated kitchen']","A rare find has arrived! This modern 3-bedroom residence redefines home living. Commanding a prime location in a mountain view locale, the 1273 square foot layout is pure inspiration. 2 carefully designed bathrooms and a 0.2-acre lot offer the ultimate in comfort and style. Be transformed by exceptional features such as functional storage, ceiling fans, basic landscaping, modern lighting, updated kitchen. An unbelievable value at $251,500.0."
244000.0,3,2.0,1382,0.05,"['hardwood floors', 'functional storage', 'updated kitchen', 'nice appliances', 'ceiling fans', 'basic landscaping']","Perfection personified describes this inviting 3-bedroom sanctuary. Located in a golf course adjacent, this 1382 square foot residence delivers on every level. With 2 well-designed bathrooms and a generous 0.1-acre lot, comfort meets sophistication. Indulge in exceptional amenities including ceiling fans, nice appliances, basic landscaping, functional storage, hardwood floors. Your dream home awaits at just $244,000.0."
249400.0,2,1.5,1039,0.1,"['energy-efficient windows', 'nice appliances', 'hardwood floors', 'functional storage', 'basic landscaping', 'updated kitchen', 'ceiling fans']","Your dream lifestyle starts here! This beautiful 2-bedroom home is nothing short of spectacular. Perfectly positioned in a quiet cul-de-sac, the 1039 square foot residence is a true standout. 1.5 designer bathrooms and a 0.1-acre lot create an unparalleled living experience. Be captivated by remarkable features including energy-efficient windows, updated kitchen, functional storage, ceiling fans, basic landscaping. An exceptional opportunity at $249,400.0."
347200.0,5,3.0,2047,0.2,"['basic landscaping', 'nice appliances', 'hardwood floors', 'energy-efficient windows', 'modern lighting', 'functional storage']","Discover a sophisticated 5-bedroom home that truly stands out in this urban oasis. Spanning 2047 square feet on a 0.2-acre lot, this property offers 3 bathrooms and unparalleled charm. Standout features include modern lighting, nice appliances, energy-efficient windows, basic landscaping, hardwood floors. Priced at $347,200.0, this home represents an extraordinary opportunity for discerning buyers."
250600.0,3,1.5,1145,0.26,"['basic landscaping', 'functional storage', 'energy-efficient windows', 'hardwood floors', 'nice appliances', 'updated kitchen']","Introducing a home that checks every box! This picturesque 3-bedroom property is a true showstopper. Perfectly situated in a urban oasis, the 1145 square foot home is a work of art. 1.5 stunning bathrooms grace this 0.3-acre estate. Fall in love with unique features like hardwood floors, basic landscaping, functional storage. Remarkably accessible at $250,600.0."
333000.0,3,1.5,1593,0.1,"['nice appliances', 'hardwood floors', 'ceiling fans', 'updated kitchen', 'modern lighting', 'functional storage', 'basic landscaping']","A rare find has arrived! This impressive 3-bedroom residence redefines home living. Commanding a prime location in a sought-after community, the 1593 square foot layout is pure inspiration. 1.5 carefully designed bathrooms and a 0.1-acre lot offer the ultimate in comfort and style. Be transformed by exceptional features such as functional storage, hardwood floors, ceiling fans, modern lighting, nice appliances. An unbelievable value at $333,000.0."
