Price,Bedrooms,Bathrooms,Square Footage,Lot Size (Acres),Features,Listing Description
361700.0,5,2.5,2019,0.1,"['spa-like bathrooms', 'professional landscaping', 'walk-in closets', 'gourmet kitchen', 'smart home features', 'energy-efficient systems', 'outdoor living spaces', 'hardwood floors', 'custom lighting']","Prepare for love at first sight with this exceptional 5-bedroom retreat. Tucked away in a scenic enclave, the 2019 square foot home is a sanctuary of modern design. 2.5 thoughtfully designed bathrooms complement the expansive 0.1-acre property. Discover exceptional living through features like walk-in closets, professional landscaping, custom lighting. An unbeatable value at $361,700.0."
280600.0,3,1.5,1384,0.16,"['energy-efficient windows', 'functional storage', 'nice appliances', 'basic landscaping', 'ceiling fans', 'updated kitchen']","Prepare for love at first sight with this charming 3-bedroom retreat. Tucked away in a tree-lined street, the 1384 square foot home is a sanctuary of modern design. 1.5 thoughtfully designed bathrooms complement the expansive 0.2-acre property. Discover exceptional living through features like nice appliances, updated kitchen, ceiling fans, basic landscaping, functional storage. An unbeatable value at $280,600.0."
384300.0,4,2.0,1617,0.1,"['custom lighting', 'professional landscaping', 'walk-in closets', 'gourmet kitchen', 'outdoor living spaces', 'designer windows', 'smart home features']","Your search for perfection ends here! This inviting 4-bedroom home is simply incomparable. Located in a desirable subdivision, the 1617 square foot residence is a breath of fresh air. 2 elegantly appointed bathrooms complement the 0.1-acre grounds. Experience living at its finest with extraordinary features including smart home features, custom lighting, walk-in closets. An investment in your future at $384,300.0."
545400.0,3,1.5,1741,0.44,"['designer windows', 'walk-in closets', 'professional landscaping', 'spa-like bathrooms', 'custom lighting', 'high-end appliances', 'smart home features', 'gourmet kitchen', 'outdoor living spaces', 'energy-efficient systems']","A rare find has arrived! This stunning 3-bedroom residence redefines home living. Commanding a prime location in a tree-lined street, the 1741 square foot layout is pure inspiration. 1.5 carefully designed bathrooms and a 0.4-acre lot offer the ultimate in comfort and style. Be transformed by exceptional features such as energy-efficient systems, outdoor living spaces, high-end appliances, custom lighting. An unbelievable value at $545,400.0."
270000.0,2,1.0,1339,0.1,"['ceiling fans', 'hardwood floors', 'energy-efficient windows', 'basic landscaping', 'modern lighting', 'functional storage', 'nice appliances']","Introducing a home that checks every box! This impressive 2-bedroom property is a true showstopper. Perfectly situated in a up-and-coming area, the 1339 square foot home is a work of art. 1 stunning bathrooms grace this 0.1-acre estate. Fall in love with unique features like modern lighting, nice appliances, hardwood floors, basic landscaping, functional storage. Remarkably accessible at $270,000.0."
270000.0,2,1.0,1278,0.19,"['modern lighting', 'nice appliances', 'ceiling fans', 'updated kitchen', 'energy-efficient windows', 'basic landscaping']","Discover a sophisticated 2-bedroom home that truly stands out in this sought-after community. Spanning 1278 square feet on a 0.2-acre lot, this property offers 1 bathrooms and unparalleled charm. Standout features include updated kitchen, nice appliances, basic landscaping, energy-efficient windows. Priced at $270,000.0, this home represents an extraordinary opportunity for discerning buyers."
557800.0,5,3.0,2358,0.5,"['walk-in closets', 'professional landscaping', 'outdoor living spaces', 'high-end appliances', 'custom lighting', 'gourmet kitchen', 'spa-like bathrooms', 'energy-efficient systems', 'smart home features', 'designer windows']","Welcome to your dream home! This breathtaking 5-bedroom residence redefines modern living. With 3 meticulously designed bathrooms and 2358 square feet of living space, every inch has been carefully considered. The 0.5-acre lot provides ample room for your lifestyle. Highlights include gourmet kitchen, high-end appliances, smart home features. At $557,800.0, this home is a rare find you won't want to miss."
403100.0,3,2.0,1790,0.34,"['energy-efficient systems', 'spa-like bathrooms', 'high-end appliances', 'outdoor living spaces', 'designer windows', 'professional landscaping', 'walk-in closets', 'smart home features', 'custom lighting']","Discover a exceptional 3-bedroom home that truly stands out in this golf course adjacent. Spanning 1790 square feet on a 0.3-acre lot, this property offers 2 bathrooms and unparalleled charm. Standout features include spa-like bathrooms, custom lighting, professional landscaping. Priced at $403,100.0, this home represents an extraordinary opportunity for discerning buyers."
245800.0,3,1.5,1409,0.13,"['updated kitchen', 'nice appliances', 'energy-efficient windows', 'hardwood floors', 'modern lighting', 'basic landscaping']","Your search ends here! This serene 3-bedroom masterpiece is a testament to refined living. Nestled in a waterfront community, the 1409 square foot home boasts 1.5 perfectly appointed bathrooms. The 0.1-acre property offers both elegance and functionality. Elevate your lifestyle with features like hardwood floors, energy-efficient windows, modern lighting, nice appliances. Competitively priced at $245,800.0, this home won't last long."
368400.0,3,2.0,1439,0.26,"['energy-efficient systems', 'spa-like bathrooms', 'custom lighting', 'high-end appliances', 'outdoor living spaces', 'hardwood floors', 'professional landscaping']","Prepare for love at first sight with this beautiful 3-bedroom retreat. Tucked away in a quiet cul-de-sac, the 1439 square foot home is a sanctuary of modern design. 2 thoughtfully designed bathrooms complement the expansive 0.3-acre property. Discover exceptional living through features like professional landscaping, custom lighting, outdoor living spaces, high-end appliances, spa-like bathrooms. An unbeatable value at $368,400.0."
246400.0,2,1.5,1463,0.05,"['nice appliances', 'ceiling fans', 'modern lighting', 'functional storage', 'energy-efficient windows', 'hardwood floors']","Prepare to be impressed by this classic home that seamlessly blends comfort and style. Boasting 2 bedrooms, 1.5 bathrooms, and 1463 square feet of thoughtfully designed space, this waterfront community property sits on a 0.1-acre lot that promises privacy and potential. Unique features such as nice appliances, hardwood floors, ceiling fans, functional storage set this home apart. Offered at $246,400.0, this is an investment in your future."
246200.0,3,2.0,1239,0.06,"['energy-efficient windows', 'nice appliances', 'modern lighting', 'ceiling fans', 'basic landscaping', 'functional storage', 'updated kitchen', 'hardwood floors']","Perfection personified describes this sophisticated 3-bedroom sanctuary. Located in a peaceful neighborhood, this 1239 square foot residence delivers on every level. With 2 well-designed bathrooms and a generous 0.1-acre lot, comfort meets sophistication. Indulge in exceptional amenities including hardwood floors, functional storage, energy-efficient windows. Your dream home awaits at just $246,200.0."
326700.0,5,2.5,2222,0.1,"['hardwood floors', 'updated kitchen', 'ceiling fans', 'energy-efficient windows', 'basic landscaping', 'functional storage']","Prepare for love at first sight with this incredible 5-bedroom retreat. Tucked away in a golf course adjacent, the 2222 square foot home is a sanctuary of modern design. 2.5 thoughtfully designed bathrooms complement the expansive 0.1-acre property. Discover exceptional living through features like updated kitchen, energy-efficient windows, hardwood floors. An unbeatable value at $326,700.0."
150000.0,2,1.0,731,0.05,"['basic tile floors', 'basic lighting', 'vinyl siding']","Perfection personified describes this picturesque 2-bedroom sanctuary. Located in a peaceful neighborhood, this 731 square foot residence delivers on every level. With 1 well-designed bathrooms and a generous 0.1-acre lot, comfort meets sophistication. Indulge in exceptional amenities including vinyl siding, basic lighting, basic tile floors. Your dream home awaits at just $150,000."
150000.0,2,1.0,973,0.14,"['vinyl siding', 'basic lighting', 'modest kitchen', 'basic tile floors', 'standard windows']","Your dream lifestyle starts here! This breathtaking 2-bedroom home is nothing short of spectacular. Perfectly positioned in a quiet cul-de-sac, the 973 square foot residence is a true standout. 1 designer bathrooms and a 0.1-acre lot create an unparalleled living experience. Be captivated by remarkable features including vinyl siding, standard windows, basic lighting. An exceptional opportunity at $150,000."
236800.0,2,1.5,1239,0.09,"['modern lighting', 'ceiling fans', 'functional storage', 'nice appliances', 'basic landscaping', 'updated kitchen']","A home that truly has it all! This impressive 2-bedroom property is a game-changer. Situated in a scenic enclave, the 1239 square foot layout maximizes every square inch. 1.5 beautifully designed bathrooms grace this 0.1-acre retreat. Fall in love with exceptional features such as basic landscaping, functional storage, nice appliances, modern lighting. An incredible value at $236,800.0."
197800.0,2,1.0,734,0.09,"['standard windows', 'modest kitchen', 'basic lighting', 'vinyl siding', 'basic tile floors', 'simple appliances']","Introducing a home that checks every box! This breathtaking 2-bedroom property is a true showstopper. Perfectly situated in a golf course adjacent, the 734 square foot home is a work of art. 1 stunning bathrooms grace this 0.1-acre estate. Fall in love with unique features like basic lighting, standard windows, vinyl siding. Remarkably accessible at $197,800.0."
336300.0,3,1.5,1454,0.1,"['nice appliances', 'ceiling fans', 'energy-efficient windows', 'basic landscaping', 'functional storage', 'updated kitchen', 'modern lighting', 'hardwood floors']","A home that truly has it all! This delightful 3-bedroom property is a game-changer. Situated in a desirable subdivision, the 1454 square foot layout maximizes every square inch. 1.5 beautifully designed bathrooms grace this 0.1-acre retreat. Fall in love with exceptional features such as basic landscaping, modern lighting, ceiling fans, hardwood floors, nice appliances. An incredible value at $336,300.0."
206200.0,3,2.0,1135,0.13,"['modern lighting', 'functional storage', 'updated kitchen', 'hardwood floors', 'nice appliances', 'ceiling fans']","Prepare to be amazed by this inviting 3-bedroom masterpiece. Anchored in a riverside setting, the 1135 square foot home is a testament to sophisticated living. 2 luxurious bathrooms complement the expansive 0.1-acre property. Experience the extraordinary with features like hardwood floors, ceiling fans, modern lighting, functional storage. Sensationally priced at $206,200.0."
168600.0,2,1.0,842,0.05,"['vinyl siding', 'basic lighting', 'modest kitchen', 'standard windows']","Your search for perfection ends here! This classic 2-bedroom home is a cut above the rest. Nestled in a riverside setting, the 842 square foot layout defines modern living. With 1 impeccable bathrooms spread across a 0.1-acre paradise, comfort knows no bounds. Elevate your lifestyle with extraordinary features like vinyl siding, standard windows, modest kitchen, basic lighting. Priced to sell at $168,600.0."
533000.0,4,2.0,2209,0.51,"['smart home features', 'hardwood floors', 'professional landscaping', 'outdoor living spaces', 'custom lighting', 'walk-in closets', 'energy-efficient systems', 'designer windows', 'high-end appliances']","A rare find has arrived! This delightful 4-bedroom residence redefines home living. Commanding a prime location in a urban oasis, the 2209 square foot layout is pure inspiration. 2 carefully designed bathrooms and a 0.5-acre lot offer the ultimate in comfort and style. Be transformed by exceptional features such as professional landscaping, energy-efficient systems, custom lighting, high-end appliances, outdoor living spaces. An unbelievable value at $533,000.0."
270900.0,3,1.5,1085,0.2,"['functional storage', 'hardwood floors', 'energy-efficient windows', 'nice appliances', 'updated kitchen', 'ceiling fans', 'basic landscaping', 'modern lighting']","Architectural brilliance meets everyday comfort in this luxurious 3-bedroom masterpiece. Commanding a prime spot in a peaceful neighborhood, the 1085 square foot residence speaks volumes. 1.5 designer bathrooms and a 0.2-acre lot create the ultimate living environment. Be captivated by unique elements such as energy-efficient windows, basic landscaping, modern lighting, nice appliances. Exclusively available at $270,900.0."
304700.0,3,1.5,1592,0.31,"['basic landscaping', 'modern lighting', 'hardwood floors', 'ceiling fans', 'energy-efficient windows', 'nice appliances', 'updated kitchen', 'functional storage']","Prepare to be impressed by this picturesque home that seamlessly blends comfort and style. Boasting 3 bedrooms, 1.5 bathrooms, and 1592 square feet of thoughtfully designed space, this waterfront community property sits on a 0.3-acre lot that promises privacy and potential. Unique features such as basic landscaping, functional storage, ceiling fans set this home apart. Offered at $304,700.0, this is an investment in your future."
167700.0,3,1.5,1014,0.05,"['basic tile floors', 'basic lighting', 'simple appliances', 'modest kitchen']","Prepare to be impressed by this remarkable home that seamlessly blends comfort and style. Boasting 3 bedrooms, 1.5 bathrooms, and 1014 square feet of thoughtfully designed space, this quiet cul-de-sac property sits on a 0.1-acre lot that promises privacy and potential. Unique features such as modest kitchen, basic lighting, basic tile floors set this home apart. Offered at $167,700.0, this is an investment in your future."
238500.0,4,2.5,1545,0.05,"['functional storage', 'hardwood floors', 'nice appliances', 'updated kitchen', 'ceiling fans']","A true gem has arrived! This breathtaking 4-bedroom home represents the pinnacle of contemporary living. Strategically positioned in a mountain view locale, the property spans 1545 square feet of pure inspiration. 2.5 bathrooms provide both luxury and practicality on a 0.1-acre canvas. Distinguished by ceiling fans, updated kitchen, hardwood floors, this home transcends ordinary expectations. Incredibly priced at $238,500.0, opportunity knocks."
310000.0,3,1.5,1730,0.19,"['updated kitchen', 'energy-efficient windows', 'nice appliances', 'modern lighting', 'functional storage']","Perfection personified describes this impressive 3-bedroom sanctuary. Located in a sought-after community, this 1730 square foot residence delivers on every level. With 1.5 well-designed bathrooms and a generous 0.2-acre lot, comfort meets sophistication. Indulge in exceptional amenities including updated kitchen, nice appliances, modern lighting. Your dream home awaits at just $310,000.0."
187100.0,2,1.0,803,0.19,"['standard windows', 'vinyl siding', 'modest kitchen', 'basic lighting']","Introducing a home that checks every box! This stunning 2-bedroom property is a true showstopper. Perfectly situated in a suburban retreat, the 803 square foot home is a work of art. 1 stunning bathrooms grace this 0.2-acre estate. Fall in love with unique features like basic lighting, modest kitchen, vinyl siding, standard windows. Remarkably accessible at $187,100.0."
344600.0,4,2.5,1636,0.29,"['ceiling fans', 'basic landscaping', 'modern lighting', 'updated kitchen', 'energy-efficient windows', 'functional storage', 'hardwood floors', 'nice appliances']","A true gem has arrived! This luxurious 4-bedroom home represents the pinnacle of contemporary living. Strategically positioned in a suburban retreat, the property spans 1636 square feet of pure inspiration. 2.5 bathrooms provide both luxury and practicality on a 0.3-acre canvas. Distinguished by ceiling fans, functional storage, basic landscaping, nice appliances, hardwood floors, this home transcends ordinary expectations. Incredibly priced at $344,600.0, opportunity knocks."
233200.0,3,1.5,1322,0.11,"['nice appliances', 'hardwood floors', 'energy-efficient windows', 'modern lighting', 'functional storage', 'basic landscaping']","Prepare to be impressed by this inviting home that seamlessly blends comfort and style. Boasting 3 bedrooms, 1.5 bathrooms, and 1322 square feet of thoughtfully designed space, this waterfront community property sits on a 0.1-acre lot that promises privacy and potential. Unique features such as basic landscaping, hardwood floors, modern lighting set this home apart. Offered at $233,200.0, this is an investment in your future."
263900.0,2,1.0,995,0.12,"['basic landscaping', 'ceiling fans', 'energy-efficient windows', 'nice appliances', 'functional storage', 'updated kitchen', 'hardwood floors']","Luxury meets functionality in this picturesque 2-bedroom treasure. Nestled in a mountain view locale, the 995 square foot home is a masterpiece of modern design. 1 impeccable bathrooms adorn this 0.1-acre paradise. Discover living at its finest with features like energy-efficient windows, hardwood floors, nice appliances, basic landscaping. Priced to impress at $263,900.0."
233100.0,3,2.0,1148,0.14,"['hardwood floors', 'basic landscaping', 'energy-efficient windows', 'nice appliances', 'functional storage', 'ceiling fans', 'modern lighting']","Prepare to be impressed by this modern home that seamlessly blends comfort and style. Boasting 3 bedrooms, 2 bathrooms, and 1148 square feet of thoughtfully designed space, this peaceful neighborhood property sits on a 0.1-acre lot that promises privacy and potential. Unique features such as modern lighting, functional storage, basic landscaping, nice appliances, hardwood floors set this home apart. Offered at $233,100.0, this is an investment in your future."
622100.0,4,2.0,1500,0.31,"['energy-efficient systems', 'hardwood floors', 'custom lighting', 'gourmet kitchen', 'designer windows', 'high-end appliances', 'outdoor living spaces']","Architectural brilliance meets everyday comfort in this luxurious 4-bedroom masterpiece. Commanding a prime spot in a golf course adjacent, the 1500 square foot residence speaks volumes. 2 designer bathrooms and a 0.3-acre lot create the ultimate living environment. Be captivated by unique elements such as outdoor living spaces, energy-efficient systems, hardwood floors, gourmet kitchen. Exclusively available at $622,100.0."
295000.0,3,2.0,1279,0.22,"['nice appliances', 'ceiling fans', 'hardwood floors', 'basic landscaping', 'updated kitchen']","Your dream lifestyle starts here! This elegant 3-bedroom home is nothing short of spectacular. Perfectly positioned in a golf course adjacent, the 1279 square foot residence is a true standout. 2 designer bathrooms and a 0.2-acre lot create an unparalleled living experience. Be captivated by remarkable features including nice appliances, ceiling fans, updated kitchen, hardwood floors, basic landscaping. An exceptional opportunity at $295,000.0."
194300.0,2,1.0,864,0.13,"['simple appliances', 'vinyl siding', 'basic lighting', 'modest kitchen']","Your search ends here! This picturesque 2-bedroom masterpiece is a testament to refined living. Nestled in a historic district, the 864 square foot home boasts 1 perfectly appointed bathrooms. The 0.1-acre property offers both elegance and functionality. Elevate your lifestyle with features like simple appliances, modest kitchen, basic lighting. Competitively priced at $194,300.0, this home won't last long."
412100.0,3,1.5,1455,0.71,"['energy-efficient systems', 'walk-in closets', 'high-end appliances', 'custom lighting', 'spa-like bathrooms', 'designer windows', 'professional landscaping', 'gourmet kitchen', 'smart home features']","Experience luxury reimagined in this sophisticated 3-bedroom marvel. Situated in a riverside setting, the 1455 square foot floor plan maximizes both style and function. Featuring 1.5 bathrooms and a sprawling 0.7-acre setting, every detail has been meticulously crafted. Standout characteristics include designer windows, professional landscaping, energy-efficient systems, spa-like bathrooms. Your lifestyle upgrade awaits at $412,100.0."
182000.0,2,1.0,957,0.24,"['simple appliances', 'vinyl siding', 'modest kitchen', 'basic tile floors', 'standard windows', 'basic lighting']","Welcome to your dream home! This charming 2-bedroom residence redefines modern living. With 1 meticulously designed bathrooms and 957 square feet of living space, every inch has been carefully considered. The 0.2-acre lot provides ample room for your lifestyle. Highlights include standard windows, basic tile floors, vinyl siding, basic lighting. At $182,000.0, this home is a rare find you won't want to miss."
322400.0,3,2.0,1232,0.21,"['hardwood floors', 'ceiling fans', 'updated kitchen', 'energy-efficient windows', 'modern lighting']","Experience luxury reimagined in this magnificent 3-bedroom marvel. Situated in a tree-lined street, the 1232 square foot floor plan maximizes both style and function. Featuring 2 bathrooms and a sprawling 0.2-acre setting, every detail has been meticulously crafted. Standout characteristics include updated kitchen, modern lighting, energy-efficient windows. Your lifestyle upgrade awaits at $322,400.0."
150000.0,2,1.0,653,0.07,"['simple appliances', 'vinyl siding', 'basic tile floors']","Your dream lifestyle starts here! This beautiful 2-bedroom home is nothing short of spectacular. Perfectly positioned in a scenic enclave, the 653 square foot residence is a true standout. 1 designer bathrooms and a 0.1-acre lot create an unparalleled living experience. Be captivated by remarkable features including basic tile floors, vinyl siding, simple appliances. An exceptional opportunity at $150,000."
174300.0,2,1.0,822,0.1,"['basic tile floors', 'simple appliances', 'standard windows', 'basic lighting']","Introducing a home that checks every box! This contemporary 2-bedroom property is a true showstopper. Perfectly situated in a waterfront community, the 822 square foot home is a work of art. 1 stunning bathrooms grace this 0.1-acre estate. Fall in love with unique features like standard windows, simple appliances, basic tile floors. Remarkably accessible at $174,300.0."
320900.0,4,2.0,1914,0.1,"['functional storage', 'modern lighting', 'ceiling fans', 'nice appliances', 'basic landscaping', 'energy-efficient windows', 'hardwood floors', 'updated kitchen']","Discover your personal oasis in this sophisticated 4-bedroom haven. Strategically located in a waterfront community, the 1914 square foot home is a breath of fresh air. 2 meticulously crafted bathrooms and a 0.1-acre lot offer the ultimate in privacy and comfort. Distinctive touches like energy-efficient windows, hardwood floors, nice appliances, functional storage set this property apart. Remarkably priced at $320,900.0."
398500.0,5,2.5,2105,0.1,"['designer windows', 'gourmet kitchen', 'walk-in closets', 'smart home features', 'outdoor living spaces', 'custom lighting', 'spa-like bathrooms', 'hardwood floors', 'professional landscaping']","Architectural brilliance meets everyday comfort in this incredible 5-bedroom masterpiece. Commanding a prime spot in a tree-lined street, the 2105 square foot residence speaks volumes. 2.5 designer bathrooms and a 0.1-acre lot create the ultimate living environment. Be captivated by unique elements such as professional landscaping, spa-like bathrooms, outdoor living spaces, designer windows, smart home features. Exclusively available at $398,500.0."
317600.0,3,1.5,1462,0.13,"['basic landscaping', 'updated kitchen', 'energy-efficient windows', 'ceiling fans', 'hardwood floors', 'functional storage', 'modern lighting']","Experience luxury reimagined in this impressive 3-bedroom marvel. Situated in a desirable subdivision, the 1462 square foot floor plan maximizes both style and function. Featuring 1.5 bathrooms and a sprawling 0.1-acre setting, every detail has been meticulously crafted. Standout characteristics include basic landscaping, updated kitchen, functional storage, energy-efficient windows, hardwood floors. Your lifestyle upgrade awaits at $317,600.0."
283200.0,2,1.5,1415,0.12,"['energy-efficient windows', 'nice appliances', 'modern lighting', 'updated kitchen', 'basic landscaping', 'functional storage', 'hardwood floors', 'ceiling fans']","Prepare for love at first sight with this luxurious 2-bedroom retreat. Tucked away in a prime location, the 1415 square foot home is a sanctuary of modern design. 1.5 thoughtfully designed bathrooms complement the expansive 0.1-acre property. Discover exceptional living through features like energy-efficient windows, basic landscaping, updated kitchen, ceiling fans, nice appliances. An unbeatable value at $283,200.0."
262900.0,3,1.5,1192,0.19,"['functional storage', 'updated kitchen', 'energy-efficient windows', 'ceiling fans', 'modern lighting', 'basic landscaping', 'hardwood floors', 'nice appliances']","Your search ends here! This pristine 3-bedroom masterpiece is a testament to refined living. Nestled in a desirable subdivision, the 1192 square foot home boasts 1.5 perfectly appointed bathrooms. The 0.2-acre property offers both elegance and functionality. Elevate your lifestyle with features like hardwood floors, updated kitchen, energy-efficient windows, functional storage, nice appliances. Competitively priced at $262,900.0, this home won't last long."
