Price,Bedrooms,Bathrooms,Square Footage,Lot Size (Acres),Features,Listing Description
447600.0,3,1.5,1839,0.9,"['professional landscaping', 'hardwood floors', 'outdoor living spaces', 'smart home features', 'energy-efficient systems', 'gourmet kitchen', 'walk-in closets', 'high-end appliances', 'spa-like bathrooms', 'designer windows', 'custom lighting']","Prepare for love at first sight with this inviting 3-bedroom retreat. Tucked away in a historic district, the 1839 square foot home is a sanctuary of modern design. 1.5 thoughtfully designed bathrooms complement the expansive 0.9-acre property. Discover exceptional living through features like designer windows, walk-in closets, energy-efficient systems. An unbeatable value at $447,600.0."
358300.0,2,1.5,1115,0.12,"['outdoor living spaces', 'gourmet kitchen', 'energy-efficient systems', 'hardwood floors', 'walk-in closets', 'custom lighting', 'spa-like bathrooms', 'professional landscaping', 'high-end appliances', 'designer windows', 'smart home features']","Discover a stunning 2-bedroom home that truly stands out in this suburban retreat. Spanning 1115 square feet on a 0.1-acre lot, this property offers 1.5 bathrooms and unparalleled charm. Standout features include walk-in closets, energy-efficient systems, professional landscaping. Priced at $358,300.0, this home represents an extraordinary opportunity for discerning buyers."
328500.0,3,1.5,1283,0.14,"['hardwood floors', 'ceiling fans', 'basic landscaping', 'updated kitchen', 'modern lighting', 'nice appliances', 'functional storage', 'energy-efficient windows']","Luxury meets functionality in this pristine 3-bedroom treasure. Nestled in a tree-lined street, the 1283 square foot home is a masterpiece of modern design. 1.5 impeccable bathrooms adorn this 0.1-acre paradise. Discover living at its finest with features like hardwood floors, functional storage, nice appliances. Priced to impress at $328,500.0."
439400.0,2,1.5,1279,0.57,"['energy-efficient systems', 'custom lighting', 'outdoor living spaces', 'high-end appliances', 'hardwood floors', 'professional landscaping', 'designer windows', 'gourmet kitchen', 'spa-like bathrooms', 'smart home features']","Luxury meets functionality in this picturesque 2-bedroom treasure. Nestled in a prime location, the 1279 square foot home is a masterpiece of modern design. 1.5 impeccable bathrooms adorn this 0.6-acre paradise. Discover living at its finest with features like high-end appliances, professional landscaping, designer windows, spa-like bathrooms, hardwood floors. Priced to impress at $439,400.0."
577300.0,4,2.0,2380,0.81,"['gourmet kitchen', 'high-end appliances', 'hardwood floors', 'custom lighting', 'walk-in closets', 'energy-efficient systems', 'spa-like bathrooms', 'outdoor living spaces', 'designer windows']","Welcome home to elegance! This modern 4-bedroom sanctuary redefines residential living. Proudly positioned in a golf course adjacent, the 2380 square foot home is a masterclass in design. 2 spa-like bathrooms complement the expansive 0.8-acre grounds. Be impressed by premium features including high-end appliances, custom lighting, walk-in closets. An unparalleled opportunity at $577,300.0."
445000.0,5,3.0,2113,0.67,"['designer windows', 'outdoor living spaces', 'spa-like bathrooms', 'high-end appliances', 'professional landscaping', 'custom lighting', 'gourmet kitchen', 'walk-in closets', 'smart home features', 'hardwood floors']","Discover your personal oasis in this picturesque 5-bedroom haven. Strategically located in a suburban retreat, the 2113 square foot home is a breath of fresh air. 3 meticulously crafted bathrooms and a 0.7-acre lot offer the ultimate in privacy and comfort. Distinctive touches like spa-like bathrooms, designer windows, outdoor living spaces, gourmet kitchen, professional landscaping set this property apart. Remarkably priced at $445,000.0."
150000.0,2,1.5,789,0.12,"['simple appliances', 'modest kitchen', 'basic lighting']","Perfection personified describes this classic 2-bedroom sanctuary. Located in a tree-lined street, this 789 square foot residence delivers on every level. With 1.5 well-designed bathrooms and a generous 0.1-acre lot, comfort meets sophistication. Indulge in exceptional amenities including simple appliances, modest kitchen, basic lighting. Your dream home awaits at just $150,000."
177800.0,2,1.0,783,0.12,"['standard windows', 'simple appliances', 'vinyl siding']","Prepare to be amazed by this luxurious 2-bedroom masterpiece. Anchored in a waterfront community, the 783 square foot home is a testament to sophisticated living. 1 luxurious bathrooms complement the expansive 0.1-acre property. Experience the extraordinary with features like vinyl siding, simple appliances, standard windows. Sensationally priced at $177,800.0."
231000.0,3,2.0,1214,0.1,"['hardwood floors', 'basic landscaping', 'updated kitchen', 'ceiling fans', 'modern lighting', 'nice appliances']","A home that truly has it all! This contemporary 3-bedroom property is a game-changer. Situated in a suburban retreat, the 1214 square foot layout maximizes every square inch. 2 beautifully designed bathrooms grace this 0.1-acre retreat. Fall in love with exceptional features such as modern lighting, updated kitchen, ceiling fans, nice appliances. An incredible value at $231,000.0."
299700.0,3,1.5,1432,0.23,"['nice appliances', 'updated kitchen', 'energy-efficient windows', 'hardwood floors', 'modern lighting', 'functional storage', 'ceiling fans']","Discover a sophisticated 3-bedroom home that truly stands out in this waterfront community. Spanning 1432 square feet on a 0.2-acre lot, this property offers 1.5 bathrooms and unparalleled charm. Standout features include modern lighting, hardwood floors, ceiling fans. Priced at $299,700.0, this home represents an extraordinary opportunity for discerning buyers."
364800.0,3,2.0,1321,0.1,"['hardwood floors', 'gourmet kitchen', 'energy-efficient systems', 'walk-in closets', 'high-end appliances', 'custom lighting', 'designer windows', 'smart home features', 'spa-like bathrooms']","Experience luxury reimagined in this charming 3-bedroom marvel. Situated in a waterfront community, the 1321 square foot floor plan maximizes both style and function. Featuring 2 bathrooms and a sprawling 0.1-acre setting, every detail has been meticulously crafted. Standout characteristics include hardwood floors, custom lighting, high-end appliances, walk-in closets, smart home features. Your lifestyle upgrade awaits at $364,800.0."
221800.0,3,1.5,1247,0.09,"['basic landscaping', 'energy-efficient windows', 'hardwood floors', 'modern lighting', 'updated kitchen']","Discover a picturesque 3-bedroom home that truly stands out in this sought-after community. Spanning 1247 square feet on a 0.1-acre lot, this property offers 1.5 bathrooms and unparalleled charm. Standout features include updated kitchen, hardwood floors, modern lighting, basic landscaping, energy-efficient windows. Priced at $221,800.0, this home represents an extraordinary opportunity for discerning buyers."
319600.0,4,2.0,1892,0.19,"['hardwood floors', 'ceiling fans', 'basic landscaping', 'updated kitchen', 'energy-efficient windows', 'nice appliances', 'modern lighting']","Perfection personified describes this contemporary 4-bedroom sanctuary. Located in a sought-after community, this 1892 square foot residence delivers on every level. With 2 well-designed bathrooms and a generous 0.2-acre lot, comfort meets sophistication. Indulge in exceptional amenities including nice appliances, modern lighting, energy-efficient windows, ceiling fans. Your dream home awaits at just $319,600.0."
219200.0,3,1.5,1300,0.05,"['functional storage', 'hardwood floors', 'updated kitchen', 'modern lighting', 'ceiling fans']","Your dream lifestyle starts here! This magnificent 3-bedroom home is nothing short of spectacular. Perfectly positioned in a golf course adjacent, the 1300 square foot residence is a true standout. 1.5 designer bathrooms and a 0.1-acre lot create an unparalleled living experience. Be captivated by remarkable features including hardwood floors, modern lighting, functional storage, updated kitchen. An exceptional opportunity at $219,200.0."
232200.0,3,1.5,1237,0.12,"['basic landscaping', 'updated kitchen', 'functional storage', 'modern lighting', 'energy-efficient windows']","Experience luxury reimagined in this delightful 3-bedroom marvel. Situated in a up-and-coming area, the 1237 square foot floor plan maximizes both style and function. Featuring 1.5 bathrooms and a sprawling 0.1-acre setting, every detail has been meticulously crafted. Standout characteristics include modern lighting, energy-efficient windows, basic landscaping. Your lifestyle upgrade awaits at $232,200.0."
168900.0,2,1.5,900,0.09,"['vinyl siding', 'basic tile floors', 'modest kitchen', 'simple appliances', 'basic lighting', 'standard windows']","Introducing a home that checks every box! This impressive 2-bedroom property is a true showstopper. Perfectly situated in a prime location, the 900 square foot home is a work of art. 1.5 stunning bathrooms grace this 0.1-acre estate. Fall in love with unique features like modest kitchen, basic tile floors, simple appliances, basic lighting, vinyl siding. Remarkably accessible at $168,900.0."
205000.0,2,1.5,800,0.19,"['functional storage', 'nice appliances', 'energy-efficient windows', 'modern lighting', 'ceiling fans', 'basic landscaping', 'hardwood floors']","A rare find has arrived! This sophisticated 2-bedroom residence redefines home living. Commanding a prime location in a golf course adjacent, the 800 square foot layout is pure inspiration. 1.5 carefully designed bathrooms and a 0.2-acre lot offer the ultimate in comfort and style. Be transformed by exceptional features such as nice appliances, modern lighting, ceiling fans, basic landscaping, functional storage. An unbelievable value at $205,000.0."
172700.0,2,1.0,867,0.18,"['basic tile floors', 'modest kitchen', 'standard windows', 'vinyl siding']","A home that truly has it all! This picturesque 2-bedroom property is a game-changer. Situated in a scenic enclave, the 867 square foot layout maximizes every square inch. 1 beautifully designed bathrooms grace this 0.2-acre retreat. Fall in love with exceptional features such as modest kitchen, vinyl siding, standard windows. An incredible value at $172,700.0."
200700.0,3,2.0,1069,0.08,"['basic landscaping', 'functional storage', 'updated kitchen', 'nice appliances', 'energy-efficient windows', 'modern lighting']","Architectural brilliance meets everyday comfort in this sophisticated 3-bedroom masterpiece. Commanding a prime spot in a historic district, the 1069 square foot residence speaks volumes. 2 designer bathrooms and a 0.1-acre lot create the ultimate living environment. Be captivated by unique elements such as energy-efficient windows, modern lighting, functional storage, updated kitchen. Exclusively available at $200,700.0."
452000.0,4,2.5,1500,0.47,"['hardwood floors', 'outdoor living spaces', 'gourmet kitchen', 'smart home features', 'high-end appliances', 'walk-in closets', 'professional landscaping', 'spa-like bathrooms', 'custom lighting', 'energy-efficient systems', 'designer windows']","Introducing a home that checks every box! This beautiful 4-bedroom property is a true showstopper. Perfectly situated in a peaceful neighborhood, the 1500 square foot home is a work of art. 2.5 stunning bathrooms grace this 0.5-acre estate. Fall in love with unique features like gourmet kitchen, hardwood floors, walk-in closets. Remarkably accessible at $452,000.0."
202900.0,3,2.0,1302,0.1,"['ceiling fans', 'hardwood floors', 'functional storage', 'updated kitchen', 'nice appliances', 'basic landscaping']","Perfection personified describes this elegant 3-bedroom sanctuary. Located in a historic district, this 1302 square foot residence delivers on every level. With 2 well-designed bathrooms and a generous 0.1-acre lot, comfort meets sophistication. Indulge in exceptional amenities including ceiling fans, functional storage, nice appliances, basic landscaping. Your dream home awaits at just $202,900.0."
850000.0,5,3.0,3186,0.41,"['designer windows', 'outdoor living spaces', 'smart home features', 'gourmet kitchen', 'walk-in closets', 'hardwood floors', 'custom lighting', 'professional landscaping', 'spa-like bathrooms']","Your dream lifestyle starts here! This elegant 5-bedroom home is nothing short of spectacular. Perfectly positioned in a sought-after community, the 3186 square foot residence is a true standout. 3 designer bathrooms and a 0.4-acre lot create an unparalleled living experience. Be captivated by remarkable features including outdoor living spaces, hardwood floors, custom lighting. An exceptional opportunity at $850,000.0."
361300.0,4,2.0,1558,0.19,"['high-end appliances', 'custom lighting', 'gourmet kitchen', 'designer windows', 'hardwood floors', 'outdoor living spaces', 'walk-in closets', 'professional landscaping', 'energy-efficient systems', 'smart home features', 'spa-like bathrooms']","A rare find has arrived! This inviting 4-bedroom residence redefines home living. Commanding a prime location in a peaceful neighborhood, the 1558 square foot layout is pure inspiration. 2 carefully designed bathrooms and a 0.2-acre lot offer the ultimate in comfort and style. Be transformed by exceptional features such as hardwood floors, walk-in closets, custom lighting, outdoor living spaces. An unbelievable value at $361,300.0."
319300.0,3,2.0,1885,0.1,"['updated kitchen', 'energy-efficient windows', 'basic landscaping', 'hardwood floors', 'ceiling fans', 'nice appliances', 'modern lighting', 'functional storage']","A home that truly has it all! This stunning 3-bedroom property is a game-changer. Situated in a scenic enclave, the 1885 square foot layout maximizes every square inch. 2 beautifully designed bathrooms grace this 0.1-acre retreat. Fall in love with exceptional features such as energy-efficient windows, ceiling fans, hardwood floors, functional storage. An incredible value at $319,300.0."
210400.0,4,2.0,1522,0.05,"['basic landscaping', 'hardwood floors', 'updated kitchen', 'modern lighting', 'ceiling fans', 'functional storage']","Discover your personal oasis in this contemporary 4-bedroom haven. Strategically located in a historic district, the 1522 square foot home is a breath of fresh air. 2 meticulously crafted bathrooms and a 0.1-acre lot offer the ultimate in privacy and comfort. Distinctive touches like modern lighting, functional storage, hardwood floors, ceiling fans, updated kitchen set this property apart. Remarkably priced at $210,400.0."
392400.0,3,1.5,1994,0.23,"['outdoor living spaces', 'high-end appliances', 'spa-like bathrooms', 'custom lighting', 'hardwood floors', 'professional landscaping', 'walk-in closets', 'designer windows', 'gourmet kitchen']","Welcome to your dream home! This incredible 3-bedroom residence redefines modern living. With 1.5 meticulously designed bathrooms and 1994 square feet of living space, every inch has been carefully considered. The 0.2-acre lot provides ample room for your lifestyle. Highlights include gourmet kitchen, designer windows, professional landscaping, hardwood floors. At $392,400.0, this home is a rare find you won't want to miss."
235600.0,3,2.0,1527,0.13,"['functional storage', 'energy-efficient windows', 'nice appliances', 'basic landscaping', 'modern lighting']","Discover your personal oasis in this sophisticated 3-bedroom haven. Strategically located in a mountain view locale, the 1527 square foot home is a breath of fresh air. 2 meticulously crafted bathrooms and a 0.1-acre lot offer the ultimate in privacy and comfort. Distinctive touches like basic landscaping, energy-efficient windows, modern lighting, functional storage set this property apart. Remarkably priced at $235,600.0."
311400.0,4,2.5,1822,0.1,"['nice appliances', 'basic landscaping', 'modern lighting', 'functional storage', 'ceiling fans', 'hardwood floors']","Welcome to your dream home! This remarkable 4-bedroom residence redefines modern living. With 2.5 meticulously designed bathrooms and 1822 square feet of living space, every inch has been carefully considered. The 0.1-acre lot provides ample room for your lifestyle. Highlights include modern lighting, functional storage, hardwood floors. At $311,400.0, this home is a rare find you won't want to miss."
825700.0,5,2.5,2537,0.68,"['outdoor living spaces', 'energy-efficient systems', 'designer windows', 'gourmet kitchen', 'spa-like bathrooms', 'professional landscaping', 'walk-in closets', 'hardwood floors', 'smart home features']","Discover a incredible 5-bedroom home that truly stands out in this tree-lined street. Spanning 2537 square feet on a 0.7-acre lot, this property offers 2.5 bathrooms and unparalleled charm. Standout features include outdoor living spaces, walk-in closets, hardwood floors, spa-like bathrooms. Priced at $825,700.0, this home represents an extraordinary opportunity for discerning buyers."
285400.0,2,1.0,879,0.11,"['energy-efficient windows', 'ceiling fans', 'modern lighting', 'functional storage', 'hardwood floors']","Discover your personal oasis in this sophisticated 2-bedroom haven. Strategically located in a peaceful neighborhood, the 879 square foot home is a breath of fresh air. 1 meticulously crafted bathrooms and a 0.1-acre lot offer the ultimate in privacy and comfort. Distinctive touches like hardwood floors, functional storage, ceiling fans, energy-efficient windows set this property apart. Remarkably priced at $285,400.0."
469600.0,3,1.5,1901,0.55,"['outdoor living spaces', 'gourmet kitchen', 'energy-efficient systems', 'professional landscaping', 'hardwood floors', 'custom lighting', 'smart home features', 'walk-in closets', 'spa-like bathrooms', 'designer windows', 'high-end appliances']","Experience luxury reimagined in this exceptional 3-bedroom marvel. Situated in a historic district, the 1901 square foot floor plan maximizes both style and function. Featuring 1.5 bathrooms and a sprawling 0.6-acre setting, every detail has been meticulously crafted. Standout characteristics include energy-efficient systems, gourmet kitchen, hardwood floors, high-end appliances, custom lighting. Your lifestyle upgrade awaits at $469,600.0."
223800.0,2,1.5,1031,0.14,"['nice appliances', 'energy-efficient windows', 'updated kitchen', 'hardwood floors', 'functional storage']","Your search ends here! This stunning 2-bedroom masterpiece is a testament to refined living. Nestled in a riverside setting, the 1031 square foot home boasts 1.5 perfectly appointed bathrooms. The 0.1-acre property offers both elegance and functionality. Elevate your lifestyle with features like hardwood floors, functional storage, updated kitchen, nice appliances, energy-efficient windows. Competitively priced at $223,800.0, this home won't last long."
292400.0,4,2.0,1634,0.17,"['energy-efficient windows', 'updated kitchen', 'modern lighting', 'hardwood floors', 'basic landscaping', 'functional storage', 'nice appliances', 'ceiling fans']","Perfection personified describes this incredible 4-bedroom sanctuary. Located in a up-and-coming area, this 1634 square foot residence delivers on every level. With 2 well-designed bathrooms and a generous 0.2-acre lot, comfort meets sophistication. Indulge in exceptional amenities including nice appliances, ceiling fans, functional storage, energy-efficient windows, modern lighting. Your dream home awaits at just $292,400.0."
602200.0,4,2.5,1929,0.59,"['smart home features', 'walk-in closets', 'outdoor living spaces', 'gourmet kitchen', 'professional landscaping', 'hardwood floors', 'spa-like bathrooms', 'designer windows', 'high-end appliances', 'custom lighting']","Your search for perfection ends here! This breathtaking 4-bedroom home is a cut above the rest. Nestled in a prime location, the 1929 square foot layout defines modern living. With 2.5 impeccable bathrooms spread across a 0.6-acre paradise, comfort knows no bounds. Elevate your lifestyle with extraordinary features like designer windows, spa-like bathrooms, professional landscaping, gourmet kitchen. Priced to sell at $602,200.0."
230800.0,3,1.5,1224,0.07,"['energy-efficient windows', 'modern lighting', 'functional storage', 'hardwood floors', 'updated kitchen', 'nice appliances']","A true gem has arrived! This stunning 3-bedroom home represents the pinnacle of contemporary living. Strategically positioned in a suburban retreat, the property spans 1224 square feet of pure inspiration. 1.5 bathrooms provide both luxury and practicality on a 0.1-acre canvas. Distinguished by nice appliances, functional storage, updated kitchen, hardwood floors, this home transcends ordinary expectations. Incredibly priced at $230,800.0, opportunity knocks."
612300.0,5,2.5,2220,0.46,"['hardwood floors', 'spa-like bathrooms', 'outdoor living spaces', 'custom lighting', 'high-end appliances', 'smart home features', 'designer windows']","Prepare to be impressed by this picturesque home that seamlessly blends comfort and style. Boasting 5 bedrooms, 2.5 bathrooms, and 2220 square feet of thoughtfully designed space, this suburban retreat property sits on a 0.5-acre lot that promises privacy and potential. Unique features such as designer windows, spa-like bathrooms, hardwood floors, custom lighting, outdoor living spaces set this home apart. Offered at $612,300.0, this is an investment in your future."
393600.0,3,2.0,1613,0.15,"['high-end appliances', 'professional landscaping', 'gourmet kitchen', 'custom lighting', 'designer windows', 'outdoor living spaces', 'spa-like bathrooms', 'hardwood floors', 'smart home features', 'walk-in closets', 'energy-efficient systems']","Introducing a home that checks every box! This picturesque 3-bedroom property is a true showstopper. Perfectly situated in a quiet cul-de-sac, the 1613 square foot home is a work of art. 2 stunning bathrooms grace this 0.1-acre estate. Fall in love with unique features like gourmet kitchen, professional landscaping, spa-like bathrooms, high-end appliances. Remarkably accessible at $393,600.0."
236800.0,4,2.0,1539,0.06,"['energy-efficient windows', 'updated kitchen', 'basic landscaping', 'ceiling fans', 'functional storage']","Introducing a home that checks every box! This incredible 4-bedroom property is a true showstopper. Perfectly situated in a waterfront community, the 1539 square foot home is a work of art. 2 stunning bathrooms grace this 0.1-acre estate. Fall in love with unique features like basic landscaping, energy-efficient windows, updated kitchen. Remarkably accessible at $236,800.0."
381900.0,3,1.5,1413,0.15,"['custom lighting', 'professional landscaping', 'spa-like bathrooms', 'hardwood floors', 'designer windows', 'gourmet kitchen', 'walk-in closets', 'smart home features', 'outdoor living spaces']","A true gem has arrived! This magnificent 3-bedroom home represents the pinnacle of contemporary living. Strategically positioned in a sought-after community, the property spans 1413 square feet of pure inspiration. 1.5 bathrooms provide both luxury and practicality on a 0.1-acre canvas. Distinguished by custom lighting, smart home features, walk-in closets, professional landscaping, outdoor living spaces, this home transcends ordinary expectations. Incredibly priced at $381,900.0, opportunity knocks."
437600.0,3,2.0,1658,0.25,"['professional landscaping', 'spa-like bathrooms', 'smart home features', 'outdoor living spaces', 'high-end appliances', 'walk-in closets', 'hardwood floors', 'custom lighting', 'designer windows']","Discover your personal oasis in this sophisticated 3-bedroom haven. Strategically located in a mountain view locale, the 1658 square foot home is a breath of fresh air. 2 meticulously crafted bathrooms and a 0.2-acre lot offer the ultimate in privacy and comfort. Distinctive touches like custom lighting, walk-in closets, hardwood floors, designer windows set this property apart. Remarkably priced at $437,600.0."
380300.0,2,1.5,1377,0.12,"['outdoor living spaces', 'hardwood floors', 'high-end appliances', 'gourmet kitchen', 'designer windows', 'energy-efficient systems', 'smart home features']","Discover your personal oasis in this sophisticated 2-bedroom haven. Strategically located in a desirable subdivision, the 1377 square foot home is a breath of fresh air. 1.5 meticulously crafted bathrooms and a 0.1-acre lot offer the ultimate in privacy and comfort. Distinctive touches like designer windows, gourmet kitchen, outdoor living spaces, high-end appliances set this property apart. Remarkably priced at $380,300.0."
158200.0,2,1.5,667,0.09,"['vinyl siding', 'modest kitchen', 'basic tile floors', 'standard windows']","Welcome to your dream home! This exceptional 2-bedroom residence redefines modern living. With 1.5 meticulously designed bathrooms and 667 square feet of living space, every inch has been carefully considered. The 0.1-acre lot provides ample room for your lifestyle. Highlights include modest kitchen, basic tile floors, vinyl siding. At $158,200.0, this home is a rare find you won't want to miss."
221700.0,3,2.0,1077,0.09,"['nice appliances', 'ceiling fans', 'modern lighting', 'updated kitchen', 'functional storage', 'hardwood floors']","Your search ends here! This impressive 3-bedroom masterpiece is a testament to refined living. Nestled in a mountain view locale, the 1077 square foot home boasts 2 perfectly appointed bathrooms. The 0.1-acre property offers both elegance and functionality. Elevate your lifestyle with features like hardwood floors, modern lighting, ceiling fans, functional storage. Competitively priced at $221,700.0, this home won't last long."
