Price,Bedrooms,Bathrooms,Square Footage,Lot Size (Acres),Features,Listing Description
204700.0,3,1.5,1311,0.12,"['basic landscaping', 'hardwood floors', 'energy-efficient windows', 'ceiling fans', 'nice appliances', 'modern lighting', 'functional storage']","A true gem has arrived! This luxurious 3-bedroom home represents the pinnacle of contemporary living. Strategically positioned in a desirable subdivision, the property spans 1311 square feet of pure inspiration. 1.5 bathrooms provide both luxury and practicality on a 0.1-acre canvas. Distinguished by energy-efficient windows, ceiling fans, functional storage, nice appliances, basic landscaping, this home transcends ordinary expectations. Incredibly priced at $204,700.0, opportunity knocks."
289600.0,3,1.5,1215,0.21,"['hardwood floors', 'basic landscaping', 'updated kitchen', 'functional storage', 'energy-efficient windows', 'modern lighting', 'ceiling fans']","Introducing a home that checks every box! This breathtaking 3-bedroom property is a true showstopper. Perfectly situated in a tree-lined street, the 1215 square foot home is a work of art. 1.5 stunning bathrooms grace this 0.2-acre estate. Fall in love with unique features like modern lighting, energy-efficient windows, basic landscaping, ceiling fans. Remarkably accessible at $289,600.0."
150000.0,2,1.0,853,0.16,"['basic lighting', 'vinyl siding', 'modest kitchen', 'basic tile floors', 'simple appliances']","A rare find has arrived! This breathtaking 2-bedroom residence redefines home living. Commanding a prime location in a waterfront community, the 853 square foot layout is pure inspiration. 1 carefully designed bathrooms and a 0.2-acre lot offer the ultimate in comfort and style. Be transformed by exceptional features such as modest kitchen, basic lighting, basic tile floors, simple appliances. An unbelievable value at $150,000."
196900.0,2,1.5,707,0.05,"['simple appliances', 'standard windows', 'vinyl siding', 'basic lighting', 'basic tile floors']","Luxury meets functionality in this incredible 2-bedroom treasure. Nestled in a prime location, the 707 square foot home is a masterpiece of modern design. 1.5 impeccable bathrooms adorn this 0.1-acre paradise. Discover living at its finest with features like vinyl siding, standard windows, basic lighting. Priced to impress at $196,900.0."
268100.0,3,2.0,1233,0.24,"['hardwood floors', 'updated kitchen', 'basic landscaping', 'modern lighting', 'functional storage']","Perfection personified describes this magnificent 3-bedroom sanctuary. Located in a suburban retreat, this 1233 square foot residence delivers on every level. With 2 well-designed bathrooms and a generous 0.2-acre lot, comfort meets sophistication. Indulge in exceptional amenities including modern lighting, updated kitchen, hardwood floors, functional storage. Your dream home awaits at just $268,100.0."
180000.0,2,1.5,658,0.16,"['basic tile floors', 'vinyl siding', 'standard windows', 'basic lighting']","Prepare for love at first sight with this charming 2-bedroom retreat. Tucked away in a prime location, the 658 square foot home is a sanctuary of modern design. 1.5 thoughtfully designed bathrooms complement the expansive 0.2-acre property. Discover exceptional living through features like basic tile floors, vinyl siding, standard windows, basic lighting. An unbeatable value at $180,000.0."
569800.0,3,2.0,1955,0.25,"['gourmet kitchen', 'designer windows', 'smart home features', 'energy-efficient systems', 'spa-like bathrooms', 'professional landscaping', 'walk-in closets', 'outdoor living spaces', 'high-end appliances', 'custom lighting']","Discover a modern 3-bedroom home that truly stands out in this sought-after community. Spanning 1955 square feet on a 0.2-acre lot, this property offers 2 bathrooms and unparalleled charm. Standout features include high-end appliances, walk-in closets, smart home features. Priced at $569,800.0, this home represents an extraordinary opportunity for discerning buyers."
167400.0,2,1.0,709,0.12,"['simple appliances', 'standard windows', 'basic tile floors', 'modest kitchen', 'vinyl siding', 'basic lighting']","Your search ends here! This incredible 2-bedroom masterpiece is a testament to refined living. Nestled in a riverside setting, the 709 square foot home boasts 1 perfectly appointed bathrooms. The 0.1-acre property offers both elegance and functionality. Elevate your lifestyle with features like modest kitchen, simple appliances, basic lighting, basic tile floors. Competitively priced at $167,400.0, this home won't last long."
248700.0,3,1.5,1052,0.07,"['ceiling fans', 'basic landscaping', 'nice appliances', 'functional storage', 'energy-efficient windows']","A true gem has arrived! This impressive 3-bedroom home represents the pinnacle of contemporary living. Strategically positioned in a mountain view locale, the property spans 1052 square feet of pure inspiration. 1.5 bathrooms provide both luxury and practicality on a 0.1-acre canvas. Distinguished by energy-efficient windows, nice appliances, ceiling fans, this home transcends ordinary expectations. Incredibly priced at $248,700.0, opportunity knocks."
312500.0,3,2.0,1970,0.16,"['ceiling fans', 'updated kitchen', 'energy-efficient windows', 'functional storage', 'nice appliances', 'hardwood floors', 'basic landscaping', 'modern lighting']","Your search for perfection ends here! This magnificent 3-bedroom home is a cut above the rest. Nestled in a mountain view locale, the 1970 square foot layout defines modern living. With 2 impeccable bathrooms spread across a 0.2-acre paradise, comfort knows no bounds. Elevate your lifestyle with extraordinary features like ceiling fans, modern lighting, basic landscaping. Priced to sell at $312,500.0."
527800.0,4,2.0,2436,0.57,"['spa-like bathrooms', 'walk-in closets', 'designer windows', 'high-end appliances', 'smart home features', 'professional landscaping', 'outdoor living spaces', 'hardwood floors', 'gourmet kitchen', 'energy-efficient systems', 'custom lighting']","Your dream lifestyle starts here! This contemporary 4-bedroom home is nothing short of spectacular. Perfectly positioned in a prime location, the 2436 square foot residence is a true standout. 2 designer bathrooms and a 0.6-acre lot create an unparalleled living experience. Be captivated by remarkable features including walk-in closets, smart home features, high-end appliances. An exceptional opportunity at $527,800.0."
167000.0,2,1.5,860,0.08,"['basic lighting', 'modest kitchen', 'vinyl siding', 'simple appliances', 'basic tile floors', 'standard windows']","Your search for perfection ends here! This elegant 2-bedroom home is a cut above the rest. Nestled in a up-and-coming area, the 860 square foot layout defines modern living. With 1.5 impeccable bathrooms spread across a 0.1-acre paradise, comfort knows no bounds. Elevate your lifestyle with extraordinary features like basic tile floors, basic lighting, modest kitchen, simple appliances. Priced to sell at $167,000.0."
472300.0,4,2.5,1563,0.36,"['custom lighting', 'designer windows', 'outdoor living spaces', 'professional landscaping', 'walk-in closets', 'smart home features', 'gourmet kitchen']","Prepare for love at first sight with this exceptional 4-bedroom retreat. Tucked away in a historic district, the 1563 square foot home is a sanctuary of modern design. 2.5 thoughtfully designed bathrooms complement the expansive 0.4-acre property. Discover exceptional living through features like gourmet kitchen, professional landscaping, designer windows, walk-in closets, outdoor living spaces. An unbeatable value at $472,300.0."
297800.0,3,2.0,1136,0.17,"['functional storage', 'ceiling fans', 'modern lighting', 'updated kitchen', 'hardwood floors', 'basic landscaping', 'nice appliances']","Prepare for love at first sight with this stunning 3-bedroom retreat. Tucked away in a quiet cul-de-sac, the 1136 square foot home is a sanctuary of modern design. 2 thoughtfully designed bathrooms complement the expansive 0.2-acre property. Discover exceptional living through features like basic landscaping, modern lighting, nice appliances. An unbeatable value at $297,800.0."
200300.0,3,2.0,1442,0.05,"['nice appliances', 'functional storage', 'updated kitchen', 'ceiling fans', 'basic landscaping', 'hardwood floors', 'modern lighting']","Perfection personified describes this exceptional 3-bedroom sanctuary. Located in a desirable subdivision, this 1442 square foot residence delivers on every level. With 2 well-designed bathrooms and a generous 0.1-acre lot, comfort meets sophistication. Indulge in exceptional amenities including basic landscaping, updated kitchen, hardwood floors, functional storage. Your dream home awaits at just $200,300.0."
356800.0,3,2.0,1642,0.1,"['walk-in closets', 'designer windows', 'outdoor living spaces', 'professional landscaping', 'gourmet kitchen', 'smart home features', 'spa-like bathrooms']","Your search ends here! This beautiful 3-bedroom masterpiece is a testament to refined living. Nestled in a sought-after community, the 1642 square foot home boasts 2 perfectly appointed bathrooms. The 0.1-acre property offers both elegance and functionality. Elevate your lifestyle with features like designer windows, professional landscaping, walk-in closets. Competitively priced at $356,800.0, this home won't last long."
321100.0,4,2.0,2295,0.24,"['hardwood floors', 'basic landscaping', 'nice appliances', 'modern lighting', 'energy-efficient windows', 'functional storage', 'ceiling fans', 'updated kitchen']","Prepare for love at first sight with this sophisticated 4-bedroom retreat. Tucked away in a mountain view locale, the 2295 square foot home is a sanctuary of modern design. 2 thoughtfully designed bathrooms complement the expansive 0.2-acre property. Discover exceptional living through features like energy-efficient windows, basic landscaping, hardwood floors, ceiling fans. An unbeatable value at $321,100.0."
233300.0,3,2.0,1278,0.05,"['functional storage', 'nice appliances', 'updated kitchen', 'basic landscaping', 'ceiling fans', 'modern lighting', 'energy-efficient windows', 'hardwood floors']","Perfection personified describes this inviting 3-bedroom sanctuary. Located in a desirable subdivision, this 1278 square foot residence delivers on every level. With 2 well-designed bathrooms and a generous 0.1-acre lot, comfort meets sophistication. Indulge in exceptional amenities including updated kitchen, modern lighting, hardwood floors, ceiling fans, nice appliances. Your dream home awaits at just $233,300.0."
305000.0,4,2.0,1657,0.24,"['functional storage', 'nice appliances', 'modern lighting', 'energy-efficient windows', 'hardwood floors', 'ceiling fans', 'basic landscaping', 'updated kitchen']","A home that truly has it all! This remarkable 4-bedroom property is a game-changer. Situated in a up-and-coming area, the 1657 square foot layout maximizes every square inch. 2 beautifully designed bathrooms grace this 0.2-acre retreat. Fall in love with exceptional features such as ceiling fans, nice appliances, energy-efficient windows, modern lighting, updated kitchen. An incredible value at $305,000.0."
254200.0,2,1.0,1138,0.22,"['energy-efficient windows', 'updated kitchen', 'ceiling fans', 'functional storage', 'modern lighting']","Architectural brilliance meets everyday comfort in this pristine 2-bedroom masterpiece. Commanding a prime spot in a golf course adjacent, the 1138 square foot residence speaks volumes. 1 designer bathrooms and a 0.2-acre lot create the ultimate living environment. Be captivated by unique elements such as updated kitchen, modern lighting, functional storage. Exclusively available at $254,200.0."
310300.0,4,2.5,1640,0.1,"['modern lighting', 'ceiling fans', 'nice appliances', 'functional storage', 'hardwood floors']","Prepare to be impressed by this modern home that seamlessly blends comfort and style. Boasting 4 bedrooms, 2.5 bathrooms, and 1640 square feet of thoughtfully designed space, this riverside setting property sits on a 0.1-acre lot that promises privacy and potential. Unique features such as ceiling fans, functional storage, nice appliances, hardwood floors, modern lighting set this home apart. Offered at $310,300.0, this is an investment in your future."
386500.0,4,2.0,1554,0.1,"['high-end appliances', 'gourmet kitchen', 'walk-in closets', 'spa-like bathrooms', 'custom lighting', 'energy-efficient systems', 'professional landscaping', 'outdoor living spaces', 'hardwood floors']","Discover a charming 4-bedroom home that truly stands out in this historic district. Spanning 1554 square feet on a 0.1-acre lot, this property offers 2 bathrooms and unparalleled charm. Standout features include outdoor living spaces, spa-like bathrooms, high-end appliances. Priced at $386,500.0, this home represents an extraordinary opportunity for discerning buyers."
559300.0,5,3.0,2283,0.74,"['custom lighting', 'spa-like bathrooms', 'high-end appliances', 'outdoor living spaces', 'energy-efficient systems', 'designer windows', 'gourmet kitchen', 'hardwood floors']","Luxury meets functionality in this beautiful 5-bedroom treasure. Nestled in a historic district, the 2283 square foot home is a masterpiece of modern design. 3 impeccable bathrooms adorn this 0.7-acre paradise. Discover living at its finest with features like spa-like bathrooms, custom lighting, hardwood floors. Priced to impress at $559,300.0."
180800.0,2,1.5,895,0.05,"['standard windows', 'basic lighting', 'basic tile floors', 'modest kitchen', 'simple appliances']","Your search for perfection ends here! This stunning 2-bedroom home is a cut above the rest. Nestled in a up-and-coming area, the 895 square foot layout defines modern living. With 1.5 impeccable bathrooms spread across a 0.1-acre paradise, comfort knows no bounds. Elevate your lifestyle with extraordinary features like simple appliances, basic tile floors, modest kitchen, basic lighting, standard windows. Priced to sell at $180,800.0."
696100.0,5,3.0,2107,0.41,"['walk-in closets', 'gourmet kitchen', 'spa-like bathrooms', 'high-end appliances', 'outdoor living spaces', 'hardwood floors', 'smart home features', 'designer windows', 'energy-efficient systems', 'custom lighting', 'professional landscaping']","Your search ends here! This impressive 5-bedroom masterpiece is a testament to refined living. Nestled in a prime location, the 2107 square foot home boasts 3 perfectly appointed bathrooms. The 0.4-acre property offers both elegance and functionality. Elevate your lifestyle with features like hardwood floors, gourmet kitchen, energy-efficient systems. Competitively priced at $696,100.0, this home won't last long."
150000.0,2,1.0,666,0.12,"['standard windows', 'vinyl siding', 'basic lighting']","Prepare to be impressed by this stunning home that seamlessly blends comfort and style. Boasting 2 bedrooms, 1 bathrooms, and 666 square feet of thoughtfully designed space, this prime location property sits on a 0.1-acre lot that promises privacy and potential. Unique features such as basic lighting, standard windows, vinyl siding set this home apart. Offered at $150,000, this is an investment in your future."
279100.0,2,1.0,832,0.25,"['updated kitchen', 'functional storage', 'hardwood floors', 'energy-efficient windows', 'modern lighting', 'ceiling fans', 'basic landscaping']","Welcome to your dream home! This sophisticated 2-bedroom residence redefines modern living. With 1 meticulously designed bathrooms and 832 square feet of living space, every inch has been carefully considered. The 0.2-acre lot provides ample room for your lifestyle. Highlights include ceiling fans, energy-efficient windows, modern lighting, updated kitchen. At $279,100.0, this home is a rare find you won't want to miss."
375200.0,4,2.0,1752,0.14,"['hardwood floors', 'outdoor living spaces', 'smart home features', 'custom lighting', 'spa-like bathrooms', 'energy-efficient systems', 'professional landscaping', 'gourmet kitchen']","Discover a pristine 4-bedroom home that truly stands out in this scenic enclave. Spanning 1752 square feet on a 0.1-acre lot, this property offers 2 bathrooms and unparalleled charm. Standout features include hardwood floors, custom lighting, spa-like bathrooms, professional landscaping, smart home features. Priced at $375,200.0, this home represents an extraordinary opportunity for discerning buyers."
331800.0,3,2.0,1268,0.11,"['nice appliances', 'energy-efficient windows', 'updated kitchen', 'basic landscaping', 'hardwood floors', 'modern lighting']","Prepare for love at first sight with this pristine 3-bedroom retreat. Tucked away in a up-and-coming area, the 1268 square foot home is a sanctuary of modern design. 2 thoughtfully designed bathrooms complement the expansive 0.1-acre property. Discover exceptional living through features like basic landscaping, nice appliances, updated kitchen, energy-efficient windows. An unbeatable value at $331,800.0."
231200.0,2,1.0,800,0.17,"['functional storage', 'updated kitchen', 'nice appliances', 'ceiling fans', 'basic landscaping', 'hardwood floors']","Experience luxury reimagined in this exceptional 2-bedroom marvel. Situated in a riverside setting, the 800 square foot floor plan maximizes both style and function. Featuring 1 bathrooms and a sprawling 0.2-acre setting, every detail has been meticulously crafted. Standout characteristics include ceiling fans, basic landscaping, updated kitchen. Your lifestyle upgrade awaits at $231,200.0."
272900.0,2,1.0,1277,0.34,"['nice appliances', 'basic landscaping', 'modern lighting', 'ceiling fans', 'energy-efficient windows', 'hardwood floors', 'updated kitchen']","A rare find has arrived! This inviting 2-bedroom residence redefines home living. Commanding a prime location in a up-and-coming area, the 1277 square foot layout is pure inspiration. 1 carefully designed bathrooms and a 0.3-acre lot offer the ultimate in comfort and style. Be transformed by exceptional features such as basic landscaping, updated kitchen, ceiling fans, nice appliances. An unbelievable value at $272,900.0."
243500.0,3,1.5,1698,0.15,"['nice appliances', 'functional storage', 'ceiling fans', 'modern lighting', 'updated kitchen', 'hardwood floors']","Welcome home to elegance! This luxurious 3-bedroom sanctuary redefines residential living. Proudly positioned in a scenic enclave, the 1698 square foot home is a masterclass in design. 1.5 spa-like bathrooms complement the expansive 0.1-acre grounds. Be impressed by premium features including nice appliances, functional storage, ceiling fans. An unparalleled opportunity at $243,500.0."
234300.0,3,2.0,1198,0.1,"['updated kitchen', 'functional storage', 'ceiling fans', 'basic landscaping', 'modern lighting', 'energy-efficient windows', 'hardwood floors']","A true gem has arrived! This delightful 3-bedroom home represents the pinnacle of contemporary living. Strategically positioned in a peaceful neighborhood, the property spans 1198 square feet of pure inspiration. 2 bathrooms provide both luxury and practicality on a 0.1-acre canvas. Distinguished by ceiling fans, hardwood floors, basic landscaping, updated kitchen, energy-efficient windows, this home transcends ordinary expectations. Incredibly priced at $234,300.0, opportunity knocks."
416600.0,4,2.0,1851,0.34,"['high-end appliances', 'custom lighting', 'smart home features', 'hardwood floors', 'professional landscaping', 'outdoor living spaces', 'gourmet kitchen', 'spa-like bathrooms']","Introducing a home that checks every box! This pristine 4-bedroom property is a true showstopper. Perfectly situated in a up-and-coming area, the 1851 square foot home is a work of art. 2 stunning bathrooms grace this 0.3-acre estate. Fall in love with unique features like outdoor living spaces, spa-like bathrooms, smart home features, gourmet kitchen. Remarkably accessible at $416,600.0."
342100.0,3,2.0,1624,0.1,"['updated kitchen', 'hardwood floors', 'nice appliances', 'functional storage', 'modern lighting']","Welcome to your dream home! This elegant 3-bedroom residence redefines modern living. With 2 meticulously designed bathrooms and 1624 square feet of living space, every inch has been carefully considered. The 0.1-acre lot provides ample room for your lifestyle. Highlights include nice appliances, hardwood floors, functional storage. At $342,100.0, this home is a rare find you won't want to miss."
224800.0,2,1.5,1180,0.13,"['updated kitchen', 'functional storage', 'nice appliances', 'basic landscaping', 'hardwood floors', 'modern lighting']","Discover a classic 2-bedroom home that truly stands out in this suburban retreat. Spanning 1180 square feet on a 0.1-acre lot, this property offers 1.5 bathrooms and unparalleled charm. Standout features include functional storage, updated kitchen, basic landscaping. Priced at $224,800.0, this home represents an extraordinary opportunity for discerning buyers."
425000.0,3,1.5,1875,0.58,"['spa-like bathrooms', 'professional landscaping', 'gourmet kitchen', 'designer windows', 'hardwood floors', 'smart home features', 'energy-efficient systems']","A true gem has arrived! This breathtaking 3-bedroom home represents the pinnacle of contemporary living. Strategically positioned in a peaceful neighborhood, the property spans 1875 square feet of pure inspiration. 1.5 bathrooms provide both luxury and practicality on a 0.6-acre canvas. Distinguished by smart home features, energy-efficient systems, professional landscaping, this home transcends ordinary expectations. Incredibly priced at $425,000.0, opportunity knocks."
335300.0,3,2.0,1512,0.31,"['ceiling fans', 'basic landscaping', 'energy-efficient windows', 'hardwood floors', 'modern lighting', 'functional storage']","Welcome home to elegance! This luxurious 3-bedroom sanctuary redefines residential living. Proudly positioned in a mountain view locale, the 1512 square foot home is a masterclass in design. 2 spa-like bathrooms complement the expansive 0.3-acre grounds. Be impressed by premium features including functional storage, energy-efficient windows, ceiling fans. An unparalleled opportunity at $335,300.0."
410500.0,4,2.0,1680,0.63,"['outdoor living spaces', 'spa-like bathrooms', 'gourmet kitchen', 'hardwood floors', 'custom lighting', 'designer windows', 'walk-in closets', 'high-end appliances', 'energy-efficient systems', 'professional landscaping', 'smart home features']","A true gem has arrived! This luxurious 4-bedroom home represents the pinnacle of contemporary living. Strategically positioned in a peaceful neighborhood, the property spans 1680 square feet of pure inspiration. 2 bathrooms provide both luxury and practicality on a 0.6-acre canvas. Distinguished by professional landscaping, custom lighting, walk-in closets, gourmet kitchen, spa-like bathrooms, this home transcends ordinary expectations. Incredibly priced at $410,500.0, opportunity knocks."
381500.0,3,1.5,1696,0.1,"['hardwood floors', 'outdoor living spaces', 'professional landscaping', 'smart home features', 'custom lighting', 'high-end appliances', 'walk-in closets', 'designer windows', 'spa-like bathrooms', 'gourmet kitchen']","Prepare to be impressed by this picturesque home that seamlessly blends comfort and style. Boasting 3 bedrooms, 1.5 bathrooms, and 1696 square feet of thoughtfully designed space, this golf course adjacent property sits on a 0.1-acre lot that promises privacy and potential. Unique features such as hardwood floors, custom lighting, smart home features, gourmet kitchen set this home apart. Offered at $381,500.0, this is an investment in your future."
212900.0,3,2.0,1066,0.15,"['nice appliances', 'hardwood floors', 'modern lighting', 'ceiling fans', 'updated kitchen', 'basic landscaping']","A rare find has arrived! This luxurious 3-bedroom residence redefines home living. Commanding a prime location in a prime location, the 1066 square foot layout is pure inspiration. 2 carefully designed bathrooms and a 0.1-acre lot offer the ultimate in comfort and style. Be transformed by exceptional features such as basic landscaping, modern lighting, ceiling fans, hardwood floors, updated kitchen. An unbelievable value at $212,900.0."
237000.0,2,1.5,1398,0.05,"['energy-efficient windows', 'basic landscaping', 'updated kitchen', 'ceiling fans', 'functional storage', 'hardwood floors', 'modern lighting']","Experience luxury reimagined in this luxurious 2-bedroom marvel. Situated in a desirable subdivision, the 1398 square foot floor plan maximizes both style and function. Featuring 1.5 bathrooms and a sprawling 0.1-acre setting, every detail has been meticulously crafted. Standout characteristics include modern lighting, updated kitchen, energy-efficient windows. Your lifestyle upgrade awaits at $237,000.0."
399900.0,3,2.0,1547,0.13,"['energy-efficient systems', 'gourmet kitchen', 'smart home features', 'high-end appliances', 'professional landscaping', 'hardwood floors', 'designer windows', 'outdoor living spaces']","Your search ends here! This elegant 3-bedroom masterpiece is a testament to refined living. Nestled in a waterfront community, the 1547 square foot home boasts 2 perfectly appointed bathrooms. The 0.1-acre property offers both elegance and functionality. Elevate your lifestyle with features like energy-efficient systems, hardwood floors, smart home features. Competitively priced at $399,900.0, this home won't last long."
